TimeStamp,Date,Time,User,Tweet,Text,Location,Sentiment,Score,Pos_Score,Neg_Score,Neu_Score
2023-01-18 18:35:20+00:00,2023-01-18,18:35:20,king34_boss,"On this day in 2021, India conquered Gabba, 36 all-out to winning the Test series in Australia.

The Greatest comeb… https://t.co/wPQ7MsLv2v","on this day in  india conquered gabba  allout to winning the test series in australia

the greatest comeb… httpstcowpqmslvv",,1,0.8225,0.8225,0.0,0.0
2023-01-18 18:32:53+00:00,2023-01-18,18:32:53,ujit_shukla,"So, KL Rahul is Vice captain of indian test squad. 
He has scored two 50s  &amp; 100s in 10 test match &amp; 16 times less… https://t.co/S4wvtuL1p7","so kl rahul is vice captain of indian test squad 
he has scored two s  amp s in  test match amp  times less… httpstcoswvtulp",India,0,0.0,0.0,0.0,0.0
2023-01-18 18:32:26+00:00,2023-01-18,18:32:26,utsav045,@mufaddal_vohra The Rise of Rishabh Pant in Test Cricket 🔥 https://t.co/KTUtCZ3IrA,mufaddalvohra the rise of rishabh pant in test cricket 🔥 httpstcoktutczira,"Uttar Pradesh, India",0,0.0,0.0,0.0,0.0
2023-01-18 18:31:07+00:00,2023-01-18,18:31:07,GirishDevadig17,@abir1989 @BCCIdomestic @mastercardindia I thought IPL is about T20 cricket and we are talking about Test selection… https://t.co/Qq13eOiOCQ,abir bccidomestic mastercardindia i thought ipl is about t cricket and we are talking about test selection… httpstcoqqeoiocq,,0,0.0,0.0,0.0,0.0
2023-01-18 18:30:07+00:00,2023-01-18,18:30:07,IrelandLiveNew,Alex Lees admits disappointment over Test axe but is keen to earn another shot https://t.co/qx6vbNkj1n,alex lees admits disappointment over test axe but is keen to earn another shot httpstcoqxvbnkjn,,1,0.3612,0.3612,0.0,0.0
2023-01-18 18:30:01+00:00,2023-01-18,18:30:01,CricCrazyJohns,"On this day in 2021, India conquered Gabba, 36 all-out to winning the Test series in Australia.

The Greatest comeb… https://t.co/QLSW6JABoH","on this day in  india conquered gabba  allout to winning the test series in australia

the greatest comeb… httpstcoqlswjaboh","Kerala, India",1,0.8225,0.8225,0.0,0.0
2023-01-18 18:25:31+00:00,2023-01-18,18:25:31,shaanwaseem2,"@abinjoy2011 @cricrajdeep31 True
His consistency is dropping in Test cricket too...","abinjoy cricrajdeep true
his consistency is dropping in test cricket too",India/UAE,1,0.4215,0.4215,0.0,0.0
2023-01-18 18:18:26+00:00,2023-01-18,18:18:26,tahirthe12thman,"Thank you @amlahash for ur services to entertain the world cricket by your classical innings of test &amp; ODi’s
May yo… https://t.co/5hgClPhoL7","thank you amlahash for ur services to entertain the world cricket by your classical innings of test amp odi’s
may yo… httpstcohgclphol","Karachi, Pakistan",1,0.5859,0.5859,0.0,0.0
2023-01-18 18:17:46+00:00,2023-01-18,18:17:46,EnSquareTweet,These Days #siraj king of ODI and Test Cricket no 🧢✌️,these days siraj king of odi and test cricket no 🧢✌️,India,-1,-0.296,0.0,-0.296,0.0
2023-01-18 18:17:25+00:00,2023-01-18,18:17:25,somegadgetgeek,@Mango__Man @bhogleharsha I think there is a very bad trend going on in Indian Cricket where they become conplacent… https://t.co/QTyGmcnLOW,mangoman bhogleharsha i think there is a very bad trend going on in indian cricket where they become conplacent… httpstcoqtygmcnlow,"Mumbai, India",0,-0.5849,0.0,0.0,-0.5849
2023-01-18 18:14:34+00:00,2023-01-18,18:14:34,Ameersh28029021,@sarfarazkhan977 Cooming soon test cricket keep your fitness and score more runs like this phir dakhte hai kaise select nai karte hai,sarfarazkhan cooming soon test cricket keep your fitness and score more runs like this phir dakhte hai kaise select nai karte hai,,0,0.5965,0.0,0.0,0.5965
2023-01-18 18:10:54+00:00,2023-01-18,18:10:54,YunoosHassan,@paigecaunce Don’t hate cricket. Test cricket is going to be  No. 1 sport in the world with the increase in heart a… https://t.co/ysIOzuvoPg,paigecaunce don’t hate cricket test cricket is going to be  no  sport in the world with the increase in heart a… httpstcoysiozuvopg,,-1,-0.5574,0.0,-0.5574,0.0
2023-01-18 18:08:15+00:00,2023-01-18,18:08:15,Zemo6_ICTIAN,"200s in International Cricket

Babar Azam - 0
Shubman Gill - 1

Away Man of the Series in ODI

Babar Azam - 0
Shubm… https://t.co/8yybovgQjt","s in international cricket

babar azam  
shubman gill  

away man of the series in odi

babar azam  
shubm… httpstcoyybovgqjt",Uttrakhand india ,0,0.0,0.0,0.0,0.0
2023-01-18 18:06:38+00:00,2023-01-18,18:06:38,MediumPaceDobb1,Hashim Amla: SA's only Test triple centurion. Don't think I've felt as helpless as a fan as when he was racking up… https://t.co/xvybjIsQ96,hashim amla sas only test triple centurion dont think ive felt as helpless as a fan as when he was racking up… httpstcoxvybjisq,"England, United Kingdom",0,-0.1779,0.0,0.0,-0.1779
2023-01-18 18:04:05+00:00,2023-01-18,18:04:05,ashfaq17_02,"#HashimAmla
9,282 test runs 
8,133 odi runs
55 international 💯's
A #legend who dominated every bowler in his playin… https://t.co/wXhZ5ZvGxh","hashimamla
 test runs 
 odi runs
 international 💯s
a legend who dominated every bowler in his playin… httpstcowxhzzvgxh",earth 🌎,0,0.0,0.0,0.0,0.0
2023-01-18 18:01:38+00:00,2023-01-18,18:01:38,Sultankasher,Selectors did bad with Sarfaraz Khan by ignoring him since last 3 years … He deserves a place in Indian cricket Test team …,selectors did bad with sarfaraz khan by ignoring him since last  years … he deserves a place in indian cricket test team …,Mumbai,-1,-0.7351,0.0,-0.7351,0.0
2023-01-18 18:01:26+00:00,2023-01-18,18:01:26,MalikOuzia_,"Alex Lees, the first player properly dropped under Stokes and McCullum, on sticking with their attacking principles… https://t.co/iTxEv97v04",alex lees the first player properly dropped under stokes and mccullum on sticking with their attacking principles… httpstcoitxevv,,-1,-0.4588,0.0,-0.4588,0.0
2023-01-18 18:00:30+00:00,2023-01-18,18:00:30,WisdenCricket,"Issue 64 of Wisden Cricket Monthly is out tomorrow!

@SternWords examines how Ben Stokes’ bold and unconventional l… https://t.co/WRrSW1VAwb","issue  of wisden cricket monthly is out tomorrow

sternwords examines how ben stokes’ bold and unconventional l… httpstcowrrswvawb","The Oval, London",1,0.3818,0.3818,0.0,0.0
2023-01-18 17:54:33+00:00,2023-01-18,17:54:33,B7s7xc1mKWSxxUB,"@Tim_Clif odi &gt; t20 &gt; test

(who has time to follow test cricket?)","timclif odi gt t gt test

who has time to follow test cricket",,1,0.4939,0.4939,0.0,0.0
2023-01-18 17:54:10+00:00,2023-01-18,17:54:10,AliHasanButt,@bhogleharsha Spot on!There's room for 2 t20 batting innings within the ODI game if you have enough allrounders n t… https://t.co/DAxOnKhUnB,bhogleharsha spot ontheres room for  t batting innings within the odi game if you have enough allrounders n t… httpstcodaxonkhunb,London,0,0.0,0.0,0.0,0.0
2023-01-18 17:52:26+00:00,2023-01-18,17:52:26,iihtishamm,Only test cricketer from Pakistan who achieved this. Tons of experience must now be used properly as there’s a big… https://t.co/Zfh2nKfKS1,only test cricketer from pakistan who achieved this tons of experience must now be used properly as there’s a big… httpstcozfhnkfks,"London, England",0,0.0,0.0,0.0,0.0
2023-01-18 17:52:17+00:00,2023-01-18,17:52:17,BenjaminLappin,"@natesolon Cricket, as others have said, is the best example. While casual fans might enjoy the shorter formats (T2… https://t.co/pOmpIEy1H6",natesolon cricket as others have said is the best example while casual fans might enjoy the shorter formats t… httpstcopompieyh,Gloucestershire,1,0.8481,0.8481,0.0,0.0
2023-01-18 17:51:47+00:00,2023-01-18,17:51:47,Tanya29339801,@juicyfulltoss @BajwaKehtaHaii They are not in top 15. There’s no Pakistani pacer in top 15 in test cricket for most wickets!,juicyfulltoss bajwakehtahaii they are not in top  there’s no pakistani pacer in top  in test cricket for most wickets,,-1,-0.5242,0.0,-0.5242,0.0
2023-01-18 17:51:16+00:00,2023-01-18,17:51:16,Chefkat23,Michael Bracewell is a perfect example of someone's evolution who has spent a lot of time playing FC/LIST A/T20 cri… https://t.co/fJGQxh1Nrf,michael bracewell is a perfect example of someones evolution who has spent a lot of time playing fclist at cri… httpstcofjgqxhnrf,Jhang | Lahore,1,0.6705,0.6705,0.0,0.0
2023-01-18 17:47:12+00:00,2023-01-18,17:47:12,TineKaran,"@Adhi_Dare @bhogleharsha Steve Smith is anyway better than Sachin &amp; Lara in Test cricket..
Today's African, NZ, Aus… https://t.co/4JGdZsyOfy","adhidare bhogleharsha steve smith is anyway better than sachin amp lara in test cricket
todays african nz aus… httpstcojgdzsyofy",,1,0.4404,0.4404,0.0,0.0
2023-01-18 17:47:11+00:00,2023-01-18,17:47:11,newsroomgy,"In the course of a two-decade career, Amla, 39, scored 34,104 runs across all professional formats - 9,282 of which… https://t.co/W4yMV3Ayba",in the course of a twodecade career amla  scored  runs across all professional formats   of which… httpstcowymvayba,"Georgetown, Guyana",0,0.0,0.0,0.0,0.0
2023-01-18 17:45:03+00:00,2023-01-18,17:45:03,AwakenedHindu4,"In the realm of cricket, it is considered highly unlikely for a player to score
 
500 runs in a Test match, 
300 ru… https://t.co/wglMhk0QGy","in the realm of cricket it is considered highly unlikely for a player to score
 
 runs in a test match 
 ru… httpstcowglmhkqgy",,0,0.0,0.0,0.0,0.0
2023-01-18 17:42:42+00:00,2023-01-18,17:42:42,EastToWestLM,@rex_cricket @wecricket_ Fook off McGrath no doubt is number em then second only is Wasim Akram and then waqar youn… https://t.co/DCMQVca7sD,rexcricket wecricket fook off mcgrath no doubt is number em then second only is wasim akram and then waqar youn… httpstcodcmqvcasd,,-1,-0.5267,0.0,-0.5267,0.0
2023-01-18 17:42:41+00:00,2023-01-18,17:42:41,AKSHAYN80910305,"@AnkaraLeoMessi Rohit Sharma vs ABD overall-

1. Test cricket - ABD
2. T20I - Rohit Sharma
3. Odi - Rohit Sharma
4.… https://t.co/BvunJpv6FX","ankaraleomessi rohit sharma vs abd overall

 test cricket  abd
 ti  rohit sharma
 odi  rohit sharma
… httpstcobvunjpvfx","Kerala, India",0,0.0,0.0,0.0,0.0
2023-01-18 17:39:07+00:00,2023-01-18,17:39:07,Tanya29339801,"@juicyfulltoss @BajwaKehtaHaii Put those same bowlers in your ar*e
Who went from 54-5 to lose Asia cup
Who couldn’t… https://t.co/mtP8GEmQq6","juicyfulltoss bajwakehtahaii put those same bowlers in your are
who went from  to lose asia cup
who couldn’t… httpstcomtpgemqq",,-1,-0.4019,0.0,-0.4019,0.0
2023-01-18 17:38:04+00:00,2023-01-18,17:38:04,Hemanth_18_,"@PriyanshP22 @Sportskeeda Comparing an opener with a non-opener 🤡
Big applause for ur cricket knowledge 👏
If u want… https://t.co/69Jk7BzcYR","priyanshp sportskeeda comparing an opener with a nonopener 🤡
big applause for ur cricket knowledge 👏
if u want… httpstcojkbzcyr",,1,0.4215,0.4215,0.0,0.0
2023-01-18 17:36:31+00:00,2023-01-18,17:36:31,sanjayshs1396,This god couldn’t be 1st indian crap cricketer to score 250 run in test cricket https://t.co/falJXTbFne,this god couldn’t be st indian crap cricketer to score  run in test cricket httpstcofaljxtbfne,India,-1,-0.128,0.0,-0.128,0.0
2023-01-18 17:30:52+00:00,2023-01-18,17:30:52,VEDANTAGR2926,"Absolutely right ✅,
Ps:- I'm from Indore and want to see both key players Play here but not at the cost of BGT, Tes… https://t.co/97nDNPeMdv","absolutely right ✅
ps im from indore and want to see both key players play here but not at the cost of bgt tes… httpstcondnpemdv","Indore, India",0,0.2144,0.0,0.0,0.2144
2023-01-18 17:28:25+00:00,2023-01-18,17:28:25,jordan10RK,@superb_fan7 Test cricket is the only format which remains unpolluted. Odi is slowly dying these days,superbfan test cricket is the only format which remains unpolluted odi is slowly dying these days,Muscat,0,0.0,0.0,0.0,0.0
2023-01-18 17:26:39+00:00,2023-01-18,17:26:39,_phetogo,@gaokeupilwex That was test cricket at its very best🤌🏿,gaokeupilwex that was test cricket at its very best🤌🏿,"San Francisco, CA",0,0.0,0.0,0.0,0.0
2023-01-18 17:26:36+00:00,2023-01-18,17:26:36,rsaxena007,@SharyOfficial I have no issues if India if winning matches and Kohli not scoring. We still have many of ur fathers… https://t.co/xpO1HN4oSe,sharyofficial i have no issues if india if winning matches and kohli not scoring we still have many of ur fathers… httpstcoxpohnose,"गुड़गांव, भारत",1,0.296,0.296,0.0,0.0
2023-01-18 17:25:30+00:00,2023-01-18,17:25:30,rassie_dot_dev,"@amantlex uhm let me challenge by watching a test match at Newlands, just one day of cricket.",amantlex uhm let me challenge by watching a test match at newlands just one day of cricket,South Africa Cape Town,1,0.0772,0.0772,0.0,0.0
2023-01-19 23:56:01+00:00,2023-01-19,23:56:01,westaustralian,Michael Clarke's latest lucrative career move is now hanging by a thread in the wake of the cricket legend's wild p… https://t.co/D0LqWzOzzm,michael clarkes latest lucrative career move is now hanging by a thread in the wake of the cricket legends wild p… httpstcodlqwzozzm,"Perth, Western Australia",0,0.0,0.0,0.0,0.0
2023-01-19 23:45:28+00:00,2023-01-19,23:45:28,AI210892,@triplemcricket I have read many times that he wasn't the best team man. Don't care what goes on in his personal li… https://t.co/ktVdF0tU6u,triplemcricket i have read many times that he wasnt the best team man dont care what goes on in his personal li… httpstcoktvdftuu,San Francisco,-1,-0.7181,0.0,-0.7181,0.0
2023-01-19 23:39:58+00:00,2023-01-19,23:39:58,stumacphee,@MrWelburn @SussexCCC There's no way the ECB would have the foresight yo allow test players to go to Australia earl… https://t.co/MMdpc7dzyy,mrwelburn sussexccc theres no way the ecb would have the foresight yo allow test players to go to australia earl… httpstcommdpcdzyy,"Doncaster, South Yorkshire",-1,-0.0772,0.0,-0.0772,0.0
2023-01-19 23:20:12+00:00,2023-01-19,23:20:12,sharmanshu1,"@bhawnakohli5 But unfortunately, since then our test cricket has gone down . Lost WTC final, one test in England, t… https://t.co/FU7cakefE3",bhawnakohli but unfortunately since then our test cricket has gone down  lost wtc final one test in england t… httpstcofucakefe,,-1,-0.7227,0.0,-0.7227,0.0
2023-01-19 23:18:35+00:00,2023-01-19,23:18:35,OurSportsupdate,Best of the rest: The Aussie XI that should have played more Test cricket https://t.co/UGa1kvW0SN Cricket News,best of the rest the aussie xi that should have played more test cricket httpstcougakvwsn cricket news,,1,0.765,0.765,0.0,0.0
2023-01-19 23:11:44+00:00,2023-01-19,23:11:44,naveenjrazik,"Completely expected but disappointing to be honest. The Test Season 2, produced with CA, really suffers from the fa… https://t.co/gbI3oM4Sos",completely expected but disappointing to be honest the test season  produced with ca really suffers from the fa… httpstcogbiomsos,"SYD via BNE, sometimes CPH",-1,-0.7036,0.0,-0.7036,0.0
2023-01-19 22:34:22+00:00,2023-01-19,22:34:22,martemmett,@TheBarmyArmy Being able to watch test matches on TV during the summer and playing cricket with my Dad in our garde… https://t.co/vHYJvHr5g5,thebarmyarmy being able to watch test matches on tv during the summer and playing cricket with my dad in our garde… httpstcovhyjvhrg,England,1,0.2023,0.2023,0.0,0.0
2023-01-19 22:23:33+00:00,2023-01-19,22:23:33,UditKhar,@JBcricket103 @nathanrjohns PJ has mostly struggled at d INTL level if we set aside Test cricket. I doubt if he can… https://t.co/zCvKf9bmwC,jbcricket nathanrjohns pj has mostly struggled at d intl level if we set aside test cricket i doubt if he can… httpstcozcvkfbmwc,"Karnal, Haryana",-1,-0.5994,0.0,-0.5994,0.0
2023-01-19 22:11:51+00:00,2023-01-19,22:11:51,Pusetsi_Tlh,"Smith, Amla, Kallis, AB, Steyn, Morkel and Philander. Back when the first Proteas were a joy to watch in test crick… https://t.co/XXzlaQstbz",smith amla kallis ab steyn morkel and philander back when the first proteas were a joy to watch in test crick… httpstcoxxzlaqstbz,"Lonehill, Sandton ",0,0.5859,0.0,0.0,0.5859
2023-01-19 21:47:06+00:00,2023-01-19,21:47:06,22savagxe,Probably the best Test team in cricket history https://t.co/n9ySuHStvV,probably the best test team in cricket history httpstconysuhstvv,Pakistan,1,0.6369,0.6369,0.0,0.0
2023-01-19 21:43:03+00:00,2023-01-19,21:43:03,Wired868,"Test cricket for white-ball players, fitness consensus, center wicket practice: the CWI’s 34-point Report on T20 W/… https://t.co/SHH1QocUJb",test cricket for whiteball players fitness consensus center wicket practice the cwi’s point report on t w… httpstcoshhqocujb,Trinidad and Tobago,1,0.2732,0.2732,0.0,0.0
2023-01-19 21:41:50+00:00,2023-01-19,21:41:50,reverseflick_,He captained Pak Team at a very crucial time when  team wasn’t so good and he got a lot of unnecessary criticism th… https://t.co/DWlsqgOQwb,he captained pak team at a very crucial time when  team wasn’t so good and he got a lot of unnecessary criticism th… httpstcodwlsqgoqwb,Third Man,1,0.2123,0.2123,0.0,0.0
2023-01-19 21:31:12+00:00,2023-01-19,21:31:12,danbrettig,Hundreds of hours of unused footage from season one of The Test was destroyed by mutual agreement between Cricket A… https://t.co/vzUKi3IETX,hundreds of hours of unused footage from season one of the test was destroyed by mutual agreement between cricket a… httpstcovzukiietx,Western Victoria,0,0.0,0.0,0.0,0.0
2023-01-19 21:27:29+00:00,2023-01-19,21:27:29,Reddit_Cricket,Ricky Ponting: Watching South Africa In Australia Is The First Time I’ve Feared For The Future Of Test Cricket… https://t.co/J75TnEPajh,ricky ponting watching south africa in australia is the first time i’ve feared for the future of test cricket… httpstcojtnepajh,At the crease,-1,-0.4939,0.0,-0.4939,0.0
2023-01-19 21:21:54+00:00,2023-01-19,21:21:54,alex_mangov,@melindafarrell When I was a boy and there was very little one day cricket sides touring Australia used to have a n… https://t.co/yxERYhvuJU,melindafarrell when i was a boy and there was very little one day cricket sides touring australia used to have a n… httpstcoyxeryhvuju,,0,0.0,0.0,0.0,0.0
2023-01-19 21:15:36+00:00,2023-01-19,21:15:36,LMcKirdy7,"Love the fact that Test cricket goes off when it’s a bit dark, but tennis can still go until 4am 😂

What a remarkab… https://t.co/VlmT8tXwfC","love the fact that test cricket goes off when it’s a bit dark but tennis can still go until am 😂

what a remarkab… httpstcovlmttxwfc","Sydney, New South Wales",1,0.3818,0.3818,0.0,0.0
2023-01-19 21:13:37+00:00,2023-01-19,21:13:37,tomstyleo,"Football is a mad game.... It's no Test Cricket but still, this is crackers.",football is a mad game its no test cricket but still this is crackers,Northumberland,-1,-0.4019,0.0,-0.4019,0.0
2023-01-19 21:11:00+00:00,2023-01-19,21:11:00,DumzaNdumo,Only AB de Villiers (126 in Port Elizabeth) scored a better Test hundred for us. This was batting perfection. South… https://t.co/uA3NwyJC0q,only ab de villiers  in port elizabeth scored a better test hundred for us this was batting perfection south… httpstcouanwyjcq,"Johannesburg, South Africa",1,0.765,0.765,0.0,0.0
2023-01-19 21:10:37+00:00,2023-01-19,21:10:37,waadaplaya,Ricky Ponting has said watching Australia’s dominating 2-0 Test series victory over South Africa was the first time… https://t.co/0SXpcUqGCX,ricky ponting has said watching australia’s dominating  test series victory over south africa was the first time… httpstcosxpcuqgcx,Manhattan | Bengaluru | London,-1,-0.296,0.0,-0.296,0.0
2023-01-19 21:09:38+00:00,2023-01-19,21:09:38,jo_anna_w,@bobbydugnutt111 TEST Cricket is Testing yourself against the best. So yes @jimmy9 smashing an in form Steve Smith'… https://t.co/l3ZK9zy0tP,bobbydugnutt test cricket is testing yourself against the best so yes jimmy smashing an in form steve smith… httpstcolzkzytp,,1,0.8267,0.8267,0.0,0.0
2023-01-19 20:58:44+00:00,2023-01-19,20:58:44,OldManZack,Test cricket https://t.co/3Msn23t92t,test cricket httpstcomsntt,,0,0.0,0.0,0.0,0.0
2023-01-19 20:44:46+00:00,2023-01-19,20:44:46,davemoore9,@Stephen02371723 @SussexCCC Do you think a man who averages nearly 61 in test cricket is going to gain any real ben… https://t.co/yPBtZQgVZf,stephen sussexccc do you think a man who averages nearly  in test cricket is going to gain any real ben… httpstcoypbtzqgvzf,,1,0.5267,0.5267,0.0,0.0
2023-01-19 20:40:30+00:00,2023-01-19,20:40:30,10Kishoo,"@TheBarmyArmy 2007 world cup,india and pakistan odi series and later test cricket.",thebarmyarmy  world cupindia and pakistan odi series and later test cricket,Bangladesh,0,0.0,0.0,0.0,0.0
2023-01-19 20:38:32+00:00,2023-01-19,20:38:32,imDeepPoint,"@Sportskeeda I would not want the part time keeper to drop a chance of say a steve smith, who then goes on to hit a… https://t.co/qgFZrmCf4Z",sportskeeda i would not want the part time keeper to drop a chance of say a steve smith who then goes on to hit a… httpstcoqgfzrmcfz,,-1,-0.0829,0.0,-0.0829,0.0
2023-01-19 20:28:04+00:00,2023-01-19,20:28:04,mudassirrahman0,"@Hemanth_18_ @Criclav_18 Smith has not been given time in t20 format, he considers himself as test batsman and that… https://t.co/kmuYcYX0kj",hemanth criclav smith has not been given time in t format he considers himself as test batsman and that… httpstcokmuycyxkj,,0,0.0,0.0,0.0,0.0
2023-01-19 20:24:59+00:00,2023-01-19,20:24:59,abt_live,Kishan careful not to show ‘youngsters’ trait’ as he begins Test career https://t.co/oUVVlvIMGd #daily #package… https://t.co/t4wbDJEfbr,kishan careful not to show ‘youngsters’ trait’ as he begins test career httpstcoouvvlvimgd daily package… httpstcotwbdjefbr,India,1,0.1531,0.1531,0.0,0.0
2023-01-19 20:21:12+00:00,2023-01-19,20:21:12,DavidBilling175,@melindafarrell Have English Test players asked to play in  Australian Sheffield Shield Cricket in an Ashes season?… https://t.co/LyzKpbUkQp,melindafarrell have english test players asked to play in  australian sheffield shield cricket in an ashes season… httpstcolyzkpbukqp,,1,0.34,0.34,0.0,0.0
2023-01-19 20:13:31+00:00,2023-01-19,20:13:31,MKHalder83,@NorthStandGang @anilkumble1074 @ImIshant @RickyPonting One of the best spells in Test cricket by Ishant,northstandgang anilkumble imishant rickyponting one of the best spells in test cricket by ishant,,1,0.6369,0.6369,0.0,0.0
2023-01-19 20:12:07+00:00,2023-01-19,20:12:07,RichardHunterVa,"@SaveYourSons - Support Arsenal
- Love and cherish Test cricket
- Drive sensibly
- How to clean gutters properly
-… https://t.co/9m2XGV2XE4","saveyoursons  support arsenal
 love and cherish test cricket
 drive sensibly
 how to clean gutters properly
… httpstcomxgvxe",,1,0.9042,0.9042,0.0,0.0
2023-01-19 20:10:23+00:00,2023-01-19,20:10:23,Rossco2810,"@johnmcinroe @andy_murray Oh no, baseball is ten times more boring - at least cricket has runs! Test cricket is dul… https://t.co/oFD7VyPZZZ",johnmcinroe andymurray oh no baseball is ten times more boring  at least cricket has runs test cricket is dul… httpstcoofdvypzzz,"Adelaide, South Australia",-1,-0.5849,0.0,-0.5849,0.0
2023-01-19 20:03:57+00:00,2023-01-19,20:03:57,Tatacabnews,"Where the test between India and Australia is to be played, the Indian bowler hit ‘six’, the opposition team could… https://t.co/zWrITkNNIP",where the test between india and australia is to be played the indian bowler hit ‘six’ the opposition team could… httpstcozwritknnip,,1,0.34,0.34,0.0,0.0
2023-01-19 20:02:09+00:00,2023-01-19,20:02:09,Locky75New,@daph2theb Hated Cricket but Test Match was the shit.,daphtheb hated cricket but test match was the shit,"HD-23514, Pleiades, Con Taurus",1,0.5994,0.5994,0.0,0.0
2023-01-19 20:00:24+00:00,2023-01-19,20:00:24,Criiicworld,"CriiicWorld   | Durban Super Giants vs  Pretoria Capitals
#T20 #Cricket #ODI #Test #T10
https://t.co/KzP1o2x1CN","criiicworld    durban super giants vs  pretoria capitals
t cricket odi test t
httpstcokzpoxcn","Dubai, United Arab Emirates",1,0.5994,0.5994,0.0,0.0
2023-01-19 20:00:03+00:00,2023-01-19,20:00:03,Madnanafr10,@cricketpakcompk He is the best bowler of Test cricket. I don't know why our players are disappeared and than never… https://t.co/pVXfwzeAIu,cricketpakcompk he is the best bowler of test cricket i dont know why our players are disappeared and than never… httpstcopvxfwzeaiu,,1,0.5106,0.5106,0.0,0.0
2023-01-19 19:56:45+00:00,2023-01-19,19:56:45,stickboyguy,@bbctms @BBCSport Totally understand yr points Aggers but using context of yr playing days doesn’t  justify as it c… https://t.co/eApfZ2ixLh,bbctms bbcsport totally understand yr points aggers but using context of yr playing days doesn’t  justify as it c… httpstcoeapfzixlh,Kent England,1,0.296,0.296,0.0,0.0
2023-01-19 19:52:15+00:00,2023-01-19,19:52:15,captain_kingpin,@TheBarmyArmy I think I enjoyed getting away from my family when I was about ten years old and watching test cricke… https://t.co/keyyWMgzbl,thebarmyarmy i think i enjoyed getting away from my family when i was about ten years old and watching test cricke… httpstcokeyywmgzbl,"Wellington, New Zealand",1,0.5106,0.5106,0.0,0.0
2023-01-19 19:48:06+00:00,2023-01-19,19:48:06,SanketK__7,"What is the most difficult thing in test cricket ?

Beat Ind in India
Beat Aus in Australia
Beat Eng in England… https://t.co/tg7Qb3obK6","what is the most difficult thing in test cricket 

beat ind in india
beat aus in australia
beat eng in england… httpstcotgqbobk",India,-1,-0.4201,0.0,-0.4201,0.0
2023-01-19 19:40:49+00:00,2023-01-19,19:40:49,iplthebest,Every change in the laws of the game should be recommended by ICC cricket committe and approved by ICC board of dir… https://t.co/aaK332Hj2d,every change in the laws of the game should be recommended by icc cricket committe and approved by icc board of dir… httpstcoaakhjd,,1,0.5574,0.5574,0.0,0.0
