TimeStamp,Date,Time,User,Tweet,Text,Location,Sentiment,Score,Pos_Score,Neg_Score,Neu_Score
2023-01-16 20:35:10+00:00,2023-01-16,20:35:10,YhayaMalik,@hazharoon These are not Karachi high way bro. Where everybody is scoring centuries from 1 to 10th batters.&amp; Indian… https://t.co/1mgOlTakOc,hazharoon these are not karachi high way bro where everybody is scoring centuries from  to th battersamp indian… httpstcomgoltakoc,"Leh, Union Territory of Ladakh",0,0.0,0.0,0.0,0.0
2023-01-16 20:28:49+00:00,2023-01-16,20:28:49,sportingnewsau,"“Since it’s not in my hands, I don’t want to think too much about it...""

India snub uncapped batting phenomenon fo… https://t.co/dH3GWiRiGq","“since it’s not in my hands i don’t want to think too much about it

india snub uncapped batting phenomenon fo… httpstcodhgwirigq",Australia,-1,-0.3612,0.0,-0.3612,0.0
2023-01-16 20:14:04+00:00,2023-01-16,20:14:04,through_theGAP,"Honestly writing is on the wall....
Our generation is still into Test Cricket but I am not sure whether the upcomin… https://t.co/4yFjWRHpJz","honestly writing is on the wall
our generation is still into test cricket but i am not sure whether the upcomin… httpstcoyfjwrhpjz",,-1,-0.1136,0.0,-0.1136,0.0
2023-01-16 20:12:11+00:00,2023-01-16,20:12:11,Ben_Nwas,"I can't wait new Zealand vs England

Test series

#Cricket https://t.co/BnC9jj02Dv","i cant wait new zealand vs england

test series

cricket httpstcobncjjdv","Lagos, Nigeria",0,0.0,0.0,0.0,0.0
2023-01-16 20:12:02+00:00,2023-01-16,20:12:02,LeebBeaumont,"My favourite sports :
Ashes cricket
6 Nations
Rugby world cup
Lions
Test cricket
State of origin
Heavyweight boxing… https://t.co/gg6R6v5I16","my favourite sports 
ashes cricket
 nations
rugby world cup
lions
test cricket
state of origin
heavyweight boxing… httpstcoggrvi",,0,0.0,0.0,0.0,0.0
2023-01-16 20:08:19+00:00,2023-01-16,20:08:19,Criiicworld,"CriiicWorld   | Joburg Super Kings vs  Pretoria Capitals
#T20 #Cricket #ODI #Test #T10
https://t.co/n1a8gryOKq","criiicworld    joburg super kings vs  pretoria capitals
t cricket odi test t
httpstconagryokq","Dubai, United Arab Emirates",1,0.5994,0.5994,0.0,0.0
2023-01-16 20:07:14+00:00,2023-01-16,20:07:14,Criiicworld,"CriiicWorld  Stories | SA20 2023 Match 11 JSK vs PC: Joburg Super Kings vs Pretoria Capitals Preview, Live Streamin… https://t.co/LmZJX7qVTe",criiicworld  stories  sa  match  jsk vs pc joburg super kings vs pretoria capitals preview live streamin… httpstcolmzjxqvte,"Dubai, United Arab Emirates",1,0.5994,0.5994,0.0,0.0
2023-01-16 20:06:57+00:00,2023-01-16,20:06:57,Werries_,@17baillo17 Yes I believe Linde has a better all-round game in limited overs cricket. I was disappointed with the w… https://t.co/ozs8OI3jjo,baillo yes i believe linde has a better allround game in limited overs cricket i was disappointed with the w… httpstcoozsoijjo,,1,0.1531,0.1531,0.0,0.0
2023-01-16 20:06:33+00:00,2023-01-16,20:06:33,MarkIBoyce2,@tinobest .... 1st Div cricket was test cricket pacer..😁 https://t.co/BUjAcK7VEa,tinobest  st div cricket was test cricket pacer😁 httpstcobujackvea,"London, England",0,0.0,0.0,0.0,0.0
2023-01-16 20:06:30+00:00,2023-01-16,20:06:30,meetchintanjain,"Time and again.

If you had watch #TheTestSeason2 on @PrimeVideo, 

you would probably know why it didn't really ma… https://t.co/nXm3WfClvr","time and again

if you had watch thetestseason on primevideo 

you would probably know why it didnt really ma… httpstconxmwfclvr",,0,0.0,0.0,0.0,0.0
2023-01-16 20:05:21+00:00,2023-01-16,20:05:21,khelshel,"He was the first captain of Pakistan Test team,
Led Pakistan to the first ever Test win against India at Lucknow in… https://t.co/n6JGJrq5MP","he was the first captain of pakistan test team
led pakistan to the first ever test win against india at lucknow in… httpstconjgjrqmp","Karachi, Pakistan",1,0.5859,0.5859,0.0,0.0
2023-01-16 20:05:00+00:00,2023-01-16,20:05:00,codecricketau,"He hasn’t scored a Test century since 2019 but still, no batter will be of greater concern to Australia than… https://t.co/inNfxOdoyo",he hasn’t scored a test century since  but still no batter will be of greater concern to australia than… httpstcoinnfxodoyo,Australia,1,0.1154,0.1154,0.0,0.0
2023-01-16 20:03:25+00:00,2023-01-16,20:03:25,Clyde_K_H,@Haarrre @randomcricstat White ball specialist. Test cricket just don't seem to fit him...,haarrre randomcricstat white ball specialist test cricket just dont seem to fit him,CJ 7646,0,-0.2755,0.0,0.0,-0.2755
2023-01-16 20:01:51+00:00,2023-01-16,20:01:51,RoshanDeshpand2,@oldschoolmonk You are right in the context of 50 overs and test cricket. T20 cricket is not the same. T20 is the f… https://t.co/I6OM2znZRr,oldschoolmonk you are right in the context of  overs and test cricket t cricket is not the same t is the f… httpstcoiomznzrr,"Bengaluru, India",0,0.0,0.0,0.0,0.0
2023-01-16 20:01:26+00:00,2023-01-16,20:01:26,IndySport,Haseeb Hameed in the mood to embrace England’s new attacking approach https://t.co/Hbcq5Cmuqd https://t.co/1nAWm1LxhH,haseeb hameed in the mood to embrace england’s new attacking approach httpstcohbcqcmuqd httpstconawmlxhh,"London, England",-1,-0.1779,0.0,-0.1779,0.0
2023-01-16 20:01:22+00:00,2023-01-16,20:01:22,SowetanLIVE,Defending champion Nadal survives early test against Draper in Melbourne https://t.co/kYmdifwRss,defending champion nadal survives early test against draper in melbourne httpstcokymdifwrss,"Johannesburg, South Africa",1,0.5994,0.5994,0.0,0.0
2023-01-16 20:00:37+00:00,2023-01-16,20:00:37,Hitesh9884,"@RishabhPant17 @BCCI @JayShah You got the heart of Tiger, Fighter.
Keeping gloves and a spider.
Cause you are the c… https://t.co/npuzJHLUWL","rishabhpant bcci jayshah you got the heart of tiger fighter
keeping gloves and a spider
cause you are the c… httpstconpuzjhluwl","Veraval, India",0,0.1531,0.0,0.0,0.1531
2023-01-16 19:58:19+00:00,2023-01-16,19:58:19,Mad_Dog189,"@Haarrre Only for t20s tho,so dc. Want him to live up to the expectations and promise he showed in Test cricket,or atleast odi.",haarrre only for ts thoso dc want him to live up to the expectations and promise he showed in test cricketor atleast odi,,1,0.3818,0.3818,0.0,0.0
2023-01-16 19:57:17+00:00,2023-01-16,19:57:17,LifeIsAnElation,"@kartcric @Pradhyoth1 Right, that's where the stakeholders of test cricket have to work incredibly hard in the near… https://t.co/Rsd6CMV91g",kartcric pradhyoth right thats where the stakeholders of test cricket have to work incredibly hard in the near… httpstcorsdcmvg,India,-1,-0.1761,0.0,-0.1761,0.0
2023-01-16 19:54:45+00:00,2023-01-16,19:54:45,KrishnadityaA,@piersmorgan @juniorwaugh349 Bowling a bouncer to a batsman to hurt him and break his flow in test cricket is also… https://t.co/q4aUt5G9Se,piersmorgan juniorwaugh bowling a bouncer to a batsman to hurt him and break his flow in test cricket is also… httpstcoqautgse, Earth 🌎,-1,-0.5267,0.0,-0.5267,0.0
2023-01-16 19:53:22+00:00,2023-01-16,19:53:22,WholeStory_news,"After Test retirement, Azhar Ali to play county cricket https://t.co/O734idVVgt",after test retirement azhar ali to play county cricket httpstcooidvvgt,,0,0.34,0.0,0.0,0.34
2023-01-16 19:52:26+00:00,2023-01-16,19:52:26,VikramVenkates9,@KelRo736 @Jiggs_7 @BwanaChris @Abhai_BTTG Agreed Kelly but they kept changing his position isn’t it. First he open… https://t.co/j6Yh8sVNFd,kelro jiggs bwanachris abhaibttg agreed kelly but they kept changing his position isn’t it first he open… httpstcojyhsvnfd,,1,0.1406,0.1406,0.0,0.0
2023-01-16 19:50:21+00:00,2023-01-16,19:50:21,KesavRsays,@DMcIntyreWWE Slowly but surely ODIs are losing the sheen. A T20 star is worth more than an ODI star these days. In… https://t.co/OUjvjbnG30,dmcintyrewwe slowly but surely odis are losing the sheen a t star is worth more than an odi star these days in… httpstcooujvjbng,"Hyderabad, India",1,0.4215,0.4215,0.0,0.0
2023-01-16 19:48:30+00:00,2023-01-16,19:48:30,SQD05,@on_drive23 Also there would be 10 tests in 2025 too. So atleast few good years of test cricket atleast,ondrive also there would be  tests in  too so atleast few good years of test cricket atleast,,1,0.4877,0.4877,0.0,0.0
2023-01-16 19:48:30+00:00,2023-01-16,19:48:30,DigantaBDS,@pethadpreet123 @CricCrazyV Test Cricket is ❤️. The best format man. Too much fun to watch,pethadpreet criccrazyv test cricket is ❤️ the best format man too much fun to watch,,1,0.8176,0.8176,0.0,0.0
2023-01-16 19:46:18+00:00,2023-01-16,19:46:18,LifeIsAnElation,"@Pradhyoth1 More Test Cricket dies, more irrelevant T20 Cricket becomes.",pradhyoth more test cricket dies more irrelevant t cricket becomes,India,0,0.0,0.0,0.0,0.0
2023-01-16 19:44:46+00:00,2023-01-16,19:44:46,KBMpofu,Seeing the happy crowds at the #sa20 (and at HSC during #ZIMvIRE) has been heartwarming. Test cricket is amazing an… https://t.co/H9DyKYWyrQ,seeing the happy crowds at the sa and at hsc during zimvire has been heartwarming test cricket is amazing an… httpstcohdykywyrq,"Bulawayo, ZW.",1,0.891,0.891,0.0,0.0
2023-01-16 19:43:11+00:00,2023-01-16,19:43:11,VikramVenkates9,@Ryan_Vrede I would prefer him batting up the order even open the innings as he prefers ball coming on to the bat w… https://t.co/LYw9KPXzUQ,ryanvrede i would prefer him batting up the order even open the innings as he prefers ball coming on to the bat w… httpstcolywkpxzuq,,0,0.0,0.0,0.0,0.0
2023-01-16 19:42:58+00:00,2023-01-16,19:42:58,badeyePB,@paulharris12 @AidzMarkram Pity he can’t play test cricket though - was my pick as next superstar around 2016 (next… https://t.co/XIhlNmn6go,paulharris aidzmarkram pity he can’t play test cricket though  was my pick as next superstar around  next… httpstcoxihlnmngo,"Centurion, South Africa",1,0.0516,0.0516,0.0,0.0
2023-01-16 19:40:22+00:00,2023-01-16,19:40:22,AdityaAgarwal80,"@VishnuMadle @CruelMindAB @Smithian_again 2018 3rd test 126* 
2018 4th test 69
2014 2nd test 116
2008 1st test 63 a… https://t.co/9VGIMQH3hY","vishnumadle cruelmindab smithianagain  rd test  
 th test 
 nd test 
 st test  a… httpstcovgimqhhy",,0,0.0,0.0,0.0,0.0
2023-01-16 19:39:48+00:00,2023-01-16,19:39:48,Muhamma27349630,and also the other rivals are bullying us on the bases of south africa pak should play atleast 1 odi series in all… https://t.co/3ivxzH3lcU,and also the other rivals are bullying us on the bases of south africa pak should play atleast  odi series in all… httpstcoivxzhlcu,,-1,-0.3612,0.0,-0.3612,0.0
2023-01-16 19:35:41+00:00,2023-01-16,19:35:41,avinashsamanta,@NikhilRx10 @VegazTweet @MattLow00947877 @iamraz_ @debashish86 @flyingbeast320 First official football match played… https://t.co/28jeY6BD06,nikhilrx vegaztweet mattlow iamraz debashish flyingbeast first official football match played… httpstcojeybd,NOIDA,0,0.0,0.0,0.0,0.0
2023-01-16 19:35:41+00:00,2023-01-16,19:35:41,CronjeHelgard,"@paulharris12 @AidzMarkram De Kock is better, but be that as it may, the fact that Markram is as good as he is, mak… https://t.co/AXV1NivH1N",paulharris aidzmarkram de kock is better but be that as it may the fact that markram is as good as he is mak… httpstcoaxvnivhn,"Pretoria, South Africa",1,0.7003,0.7003,0.0,0.0
2023-01-16 19:30:20+00:00,2023-01-16,19:30:20,imsbhatt0707,"South Africa Cricket Director said - ""There's a lot of noise around Dewald Brevis. We know how good he is. He has b… https://t.co/EEC6RDEjBI",south africa cricket director said  theres a lot of noise around dewald brevis we know how good he is he has b… httpstcoeecrdejbi,"Mumbai, India",1,0.4404,0.4404,0.0,0.0
2023-01-16 19:30:15+00:00,2023-01-16,19:30:15,A2zSportsNew,"KS Bharat is a troublesome cricketer, he ought to get an opportunity within the Test sequence in opposition to Aust… https://t.co/vchS5sZeaA",ks bharat is a troublesome cricketer he ought to get an opportunity within the test sequence in opposition to aust… httpstcovchsszeaa,,-1,-0.128,0.0,-0.128,0.0
2023-01-16 19:22:55+00:00,2023-01-16,19:22:55,vinzyjadhav1807,@RVCJ_Sports Whole match wronged test cricket 😆,rvcjsports whole match wronged test cricket 😆,Iceland,-1,-0.4404,0.0,-0.4404,0.0
2023-01-16 19:17:40+00:00,2023-01-16,19:17:40,PriyankGaur9,@on_drive23 India's biggest match winner ever in test cricket??,ondrive indias biggest match winner ever in test cricket,"Mathura, India",1,0.5859,0.5859,0.0,0.0
2023-01-16 19:17:32+00:00,2023-01-16,19:17:32,reeteshjee,"South Africa have named the two coaches to lead the Men’s Test and limited-overs teams.

Read more ⬇️

https://t.co/yfGLhxqrPB","south africa have named the two coaches to lead the men’s test and limitedovers teams

read more ⬇️

httpstcoyfglhxqrpb",,0,0.0,0.0,0.0,0.0
2023-01-16 19:14:33+00:00,2023-01-16,19:14:33,AMP86793444,Nilesh Kulkarni wicket off his first ball in test cricket! And then waited eons for his second… https://t.co/5Pymqjc2tL,nilesh kulkarni wicket off his first ball in test cricket and then waited eons for his second… httpstcopymqjctl,"Leicester, England",0,0.0,0.0,0.0,0.0
2023-01-16 19:12:57+00:00,2023-01-16,19:12:57,willis_macp,"Haseeb Hameed feels an unlikely disciple of England's new Test approach, but he's made changes to his approach to e… https://t.co/ebWDO8W9lp",haseeb hameed feels an unlikely disciple of englands new test approach but hes made changes to his approach to e… httpstcoebwdowlp,London,0,0.0,0.0,0.0,0.0
2023-01-16 19:12:32+00:00,2023-01-16,19:12:32,arvins08singh,@Aarav1_ @Swagger_babu @ArchitPuria @ESPNcricinfo If u compare both great batsmen averages in Test Cricket. Dravid… https://t.co/LnkLTprRP4,aarav swaggerbabu architpuria espncricinfo if u compare both great batsmen averages in test cricket dravid… httpstcolnkltprrp,"New Delhi, India",1,0.6249,0.6249,0.0,0.0
2023-01-16 19:10:09+00:00,2023-01-16,19:10:09,MarcPaulse2,@___azraa____ Your pops better fix our test cricket!! 😭😭😭,azraa your pops better fix our test cricket 😭😭😭,"Cape Town, South Africa",0,0.4404,0.0,0.0,0.4404
2023-01-16 19:07:44+00:00,2023-01-16,19:07:44,Pratham_padu,@itsPra98 I guess they used to keep retelecast things that it just fit in memory whether it was star cricket in int… https://t.co/CNnkerNkw7,itspra i guess they used to keep retelecast things that it just fit in memory whether it was star cricket in int… httpstcocnnkernkw,Chennai,1,0.3612,0.3612,0.0,0.0
2023-01-16 19:02:08+00:00,2023-01-16,19:02:08,akhtarnawazbtm,@SYahyaHussaini @OfficialSLC @ECB_cricket @benstokes38 @TheRealPCB @ICC You people are repeatedly doing so against… https://t.co/L45DgpF3ye,syahyahussaini officialslc ecbcricket benstokes therealpcb icc you people are repeatedly doing so against… httpstcoldgpfye,,0,0.0,0.0,0.0,0.0
2023-01-16 19:00:53+00:00,2023-01-16,19:00:53,geonews_english,"Star batter was signed by Worcestershire County Club for 2023 season after he led them well in last edition

Read m… https://t.co/QOKMrXEj8m","star batter was signed by worcestershire county club for  season after he led them well in last edition

read m… httpstcoqokmrxejm","Karachi, Pakistan",1,0.2732,0.2732,0.0,0.0
2023-01-16 18:58:17+00:00,2023-01-16,18:58:17,Shabsmallie,Dean Elgar better change his attitude with the new test coach or he’ll be playing domestic cricket 😂,dean elgar better change his attitude with the new test coach or he’ll be playing domestic cricket 😂,"Cape Town,South Africa",1,0.5719,0.5719,0.0,0.0
2023-01-16 18:56:03+00:00,2023-01-16,18:56:03,thervd,"‘Baby Boycott’ to ‘Bazball’ 

Haseeb Hameed in the mood to go on the attack  https://t.co/By4e5S5oxV","‘baby boycott’ to ‘bazball’ 

haseeb hameed in the mood to go on the attack  httpstcobyesoxv",,0,-0.4767,0.0,0.0,-0.4767
2023-01-16 18:49:59+00:00,2023-01-16,18:49:59,waadaplaya,"Shukri Conrad, who has extensive experience in roles within Cricket South Africa, will take charge of the Test team… https://t.co/XksneTcUAq",shukri conrad who has extensive experience in roles within cricket south africa will take charge of the test team… httpstcoxksnetcuaq,Manhattan | Bengaluru | London,0,0.0,0.0,0.0,0.0
2023-01-16 18:48:11+00:00,2023-01-16,18:48:11,pethadpreet123,"@DigantaBDS @CricCrazyV Btw I do watch and love Test Cricket, but don't know ODI's aren't just that exciting to me,… https://t.co/JLUbfTxuJj",digantabds criccrazyv btw i do watch and love test cricket but dont know odis arent just that exciting to me… httpstcojlubftxujj,"Mumbai, India",0,-0.2124,0.0,0.0,-0.2124
2023-01-16 18:45:41+00:00,2023-01-16,18:45:41,YashG4274,@kartcric He's talking about ODI's and Test cricket.,kartcric hes talking about odis and test cricket,"Siddipet, India",0,0.0,0.0,0.0,0.0
2023-01-16 18:44:36+00:00,2023-01-16,18:44:36,SachinChanda6,"@serialchiller23 @_FaridKhan Haris rauf bowled 14 overs at first test against England,banda fir dikha nahi Puri ser… https://t.co/HYwJJTs7iE",serialchiller faridkhan haris rauf bowled  overs at first test against englandbanda fir dikha nahi puri ser… httpstcohywjjtsie,"New Delhi, India",0,0.0,0.0,0.0,0.0
2023-01-16 18:43:47+00:00,2023-01-16,18:43:47,Vaibhav_R4,@Puneite_ Asswin such a disgraceful Cricketer..He has to find ways to stay relevant when no Test Cricket is played in India,puneite asswin such a disgraceful cricketerhe has to find ways to stay relevant when no test cricket is played in india,,1,0.0516,0.0516,0.0,0.0
2023-01-16 18:42:13+00:00,2023-01-16,18:42:13,ICC,"South Africa have named the two coaches to lead the Men’s Test and limited-overs teams.

Read more ⬇️

https://t.co/xcNMNB47hn","south africa have named the two coaches to lead the men’s test and limitedovers teams

read more ⬇️

httpstcoxcnmnbhn",Dubai,0,0.0,0.0,0.0,0.0
2023-01-16 18:39:01+00:00,2023-01-16,18:39:01,dailyfastnews24,"Azhar Ali will play county cricket after Test retirement

 Latest News 

Former Pakistani cricketer Azhar...… https://t.co/ZP4gPeDxtc","azhar ali will play county cricket after test retirement

 latest news 

former pakistani cricketer azhar… httpstcozpgpedxtc",Bangladesh,0,0.34,0.0,0.0,0.34
2023-01-16 18:38:56+00:00,2023-01-16,18:38:56,SachinChanda6,@serialchiller23 @_FaridKhan Shaheen visited Australia and New Zealand .for test series.he couldn't take wickets in… https://t.co/AjWU3NOMfa,serialchiller faridkhan shaheen visited australia and new zealand for test  couldnt take wickets in… httpstcoajwunomfa,"New Delhi, India",0,0.0,0.0,0.0,0.0
2023-01-16 18:37:19+00:00,2023-01-16,18:37:19,nishantkurse844,@Aarchaismm @oldschoolmonk Test Cricket will live long,aarchaismm oldschoolmonk test cricket will live long,,0,0.0,0.0,0.0,0.0
2023-01-16 18:36:37+00:00,2023-01-16,18:36:37,girishreddyt12,"@RishabhPant17 Comeback soon champ @RishabhPant17 
Test cricket is waiting for it's superstar ❤️","rishabhpant comeback soon champ rishabhpant 
test cricket is waiting for its superstar ❤️",,1,0.4767,0.4767,0.0,0.0
2023-01-16 18:36:03+00:00,2023-01-16,18:36:03,Criiicworld,"CriiicWorld  Sports | Yonex Sunrise India Open 2023 Tickets, Schedule, map and All you need to know more
#T20… https://t.co/1hnfGLf32y","criiicworld  sports  yonex sunrise india open  tickets schedule map and all you need to know more
t… httpstcohnfglfy","Dubai, United Arab Emirates",0,0.0,0.0,0.0,0.0
2023-01-16 18:33:20+00:00,2023-01-16,18:33:20,TheYorkerBall,"Gordon Greenidge in Delhi - ""Don't Kill Test Cricket for T20s""

I only go to watch Tests, or if there’s a young pla… https://t.co/DYivX5VW5t","gordon greenidge in delhi  dont kill test cricket for ts

i only go to watch tests or if there’s a young pla… httpstcodyivxvwt",Inside Boundary - 22 Yards,1,0.5773,0.5773,0.0,0.0
2023-01-16 18:23:34+00:00,2023-01-16,18:23:34,Cricthoughts03,Who need test cricket when you are this good in t20s,who need test cricket when you are this good in ts,"Chennai, India",1,0.5228,0.5228,0.0,0.0
2023-01-16 18:20:32+00:00,2023-01-16,18:20:32,cm_bharat,@oldschoolmonk Cricket as whole isn't dieing but certainly formats like Test and ODI's need much more competitive teams ...,oldschoolmonk cricket as whole isnt dieing but certainly formats like test and odis need much more competitive teams ,,1,0.4914,0.4914,0.0,0.0
2023-01-16 18:15:39+00:00,2023-01-16,18:15:39,AkashKo09607594,@LifeIsAnElation @maaz_ad @vikrantgupta73 @ABdeVilliers17 Zimbabar average in Australia=27.😂😂Kohli average in Austr… https://t.co/V2lfK62puU,lifeisanelation maazad vikrantgupta abdevilliers zimbabar average in australia😂😂kohli average in austr… httpstcovlfkpuu,,0,0.0,0.0,0.0,0.0
2023-01-16 18:15:38+00:00,2023-01-16,18:15:38,Visakh84772734,@GokulamKeralaFC 🙄 cricket pola footballill um test match allam thudangiya...onnu randu divasam ayitt game ta resul… https://t.co/m477mUg0Fi,gokulamkeralafc 🙄 cricket pola footballill um test match allam  randu divasam ayitt game ta resul… httpstcommugfi,,0,0.0,0.0,0.0,0.0
2023-01-16 18:15:26+00:00,2023-01-16,18:15:26,InfoWriterz,"Usman Khawaja, an Australian Test batsman, claimed that racial bias still permeates cricket in the nation up to the… https://t.co/PSYZvwvSmp",usman khawaja an australian test batsman claimed that racial bias still permeates cricket in the nation up to the… httpstcopsyzvwvsmp,,-1,-0.1027,0.0,-0.1027,0.0
2023-01-16 18:15:00+00:00,2023-01-16,18:15:00,ramdewani1,@hesy_rock @_FaridKhan Bumrah miles miles ahead especially in test cricket.,hesyrock faridkhan bumrah miles miles ahead especially in test cricket,"Ulhasnagar, India",0,0.0,0.0,0.0,0.0
2023-01-16 18:13:18+00:00,2023-01-16,18:13:18,ChezFoch,Sir where were you when cheater’s @RickyPonting #michaelclare (rightly called cheater by #SirIanBotham ) won the Sy… https://t.co/SGeNSMBtmV,sir where were you when cheater’s rickyponting michaelclare rightly called cheater by sirianbotham  won the sy… httpstcosgensmbtmv,"Roissy-en-Brie, France",0,0.0516,0.0,0.0,0.0516
2023-01-16 18:09:46+00:00,2023-01-16,18:09:46,restalplays,@golghosh @oldschoolmonk I agree. The debate of real cricket vs t20 should never take place . We always should evol… https://t.co/P2eVGs5Vkm,golghosh oldschoolmonk i agree the debate of real cricket vs t should never take place  we always should evol… httpstcopevgsvkm,"Tempe, AZ",1,0.3612,0.3612,0.0,0.0
2023-01-16 18:08:28+00:00,2023-01-16,18:08:28,kau1tweet,"@Seetharm25Gna @oldschoolmonk Test cricket is the most boring. 4-5 days of cricket, Pujara's batting🥱",seetharmgna oldschoolmonk test cricket is the most boring  days of cricket pujaras batting🥱,,-1,-0.3804,0.0,-0.3804,0.0
2023-01-17 23:48:34+00:00,2023-01-17,23:48:34,Amitosh2606,@BCCIdomestic @mastercardindia Don’t know when this Run machine will be inducted in to Test side? Unbelievable to j… https://t.co/VgXuRu27jX,bccidomestic mastercardindia don’t know when this run machine will be inducted in to test side unbelievable to j… httpstcovgxurujx,,1,0.2023,0.2023,0.0,0.0
2023-01-17 23:19:30+00:00,2023-01-17,23:19:30,codecricketau,"He hasn’t scored a Test century since 2019.

Still, no batter in the #INDVAUS series will be of greater concern to… https://t.co/efG8BVECYj","he hasn’t scored a test century since 

still no batter in the indvaus series will be of greater concern to… httpstcoefgbvecyj",Australia,1,0.0772,0.0772,0.0,0.0
2023-01-17 22:56:47+00:00,2023-01-17,22:56:47,Tatacabnews,"SKY likely to make TEST DEBUT as Iyer ‘BIG DOUBT’ for Australia series, no place for ton-up Sarfaraz, Follow IND vs… https://t.co/ZhgUPzCwWd",sky likely to make test debut as iyer ‘big doubt’ for australia series no place for tonup sarfaraz follow ind vs… httpstcozhgupzcwwd,,-1,-0.296,0.0,-0.296,0.0
2023-01-17 22:52:27+00:00,2023-01-17,22:52:27,MegHPK07,Fitness is needed for women's cricketer. They are professional not a street cricketer. In future icc might bring yo… https://t.co/D6tHfKqcs6,fitness is needed for womens cricketer they are professional not a street cricketer in future icc might bring yo… httpstcodthfkqcs,India,1,0.2732,0.2732,0.0,0.0
2023-01-17 22:44:39+00:00,2023-01-17,22:44:39,manikkl,@rubingovind @mufaddal_vohra How come scores 900+ runs consecutively for three years in Ranji without fitness? He s… https://t.co/e79Ya2j8VU,rubingovind mufaddalvohra how come scores  runs consecutively for three years in ranji without fitness he s… httpstcoeyajvu,chennai,0,-0.2057,0.0,0.0,-0.2057
2023-01-17 22:33:12+00:00,2023-01-17,22:33:12,o_bakshi,@idsharma53 @Sportskeeda @BCCI @chetans1987 @iRogerBinny @PresidentOfBCCI @rahuldravid_ind @notdt @ImRo45… https://t.co/njKik7Clov,idsharma sportskeeda bcci chetans irogerbinny presidentofbcci rahuldravidind notdt imro… httpstconjkikclov,,0,0.0,0.0,0.0,0.0
2023-01-17 22:31:39+00:00,2023-01-17,22:31:39,IsaD88,"@MayneReport @2GB873 @BenFordham MCG,SCG,GABBA, WACA, Adelaide, Canberra all show part of day one International Tes… https://t.co/d3yBFNPsD7",maynereport gb benfordham mcgscggabba waca adelaide canberra all show part of day one international tes… httpstcodybfnpsd,Ngunnawal and Ngambri Country,0,0.0,0.0,0.0,0.0
2023-01-17 22:28:54+00:00,2023-01-17,22:28:54,nawaznnbn,"@ESPNcricinfo Still has not been selected for the upcoming test series, what a shame to BCCI. Merit doesn't exist u… https://t.co/qD0nRACuyT",espncricinfo still has not been selected for the upcoming test series what a shame to bcci merit doesnt exist u… httpstcoqdnracuyt,United Kingdom,0,-0.0772,0.0,0.0,-0.0772
2023-01-17 22:17:39+00:00,2023-01-17,22:17:39,Saeed_Shah56,@rinku7900 @NasimWaji @Masif0fficial Test cricket mai virat ka form aya? And talking about odis so let’s see agains… https://t.co/WhMycqtzdB,rinku nasimwaji masiffficial test cricket mai virat ka form aya and talking about odis so let’s see agains… httpstcowhmycqtzdb,,0,0.0,0.0,0.0,0.0
